Week,DPR no.,Report Date,Medium,Source ID ,Source title ,Source type,Content provider,No. of Correction,Pub year,Volume ,Issue,Article/Iss,Article title,Correction Field,Correction Type,Sub KPI,Precision/Recall,CAR Supplier
Week-5,180201-003550,1-Feb-18,Journal,318818299,International Journal of Technology,J,"Faculty of Engineering, Universitas Indonesia",-,2018,9,1,Article,COMPARATIVE PERFORMANCE OF INTERESTINGNESS MEASURES TO IDENTIFY REDUNDANT AND NON-INFORMATIVE RULES FROM WEB USAGE DATA,Single Article missing,Missing content,-,-,Thomson Digital
Week-5,180201-003550,1-Feb-18,Journal,318818299,International Journal of Technology,J,"Faculty of Engineering, Universitas Indonesia",-,2018,9,1,Article,COMPARISON OF SUPPLY CHAIN PROCESS MODELS BASED ON SERVICE-ORIENTED ARCHITECTURE,Single Article missing,Missing content,-,-,Thomson Digital
Week-5,180201-003550,1-Feb-18,Journal,318818299,International Journal of Technology,J,"Faculty of Engineering, Universitas Indonesia",-,2018,9,1,Article,IMPLEMENTATION OF LEAN PRINCIPLES TO IMPROVE THE OPERATIONS OF A SALES WAREHOUSE IN THE MANUFACTURING INDUSTRY,Single Article missing,Missing content,-,-,Thomson Digital
Week-5,180201-003550,1-Feb-18,Journal,318818299,International Journal of Technology,J,"Faculty of Engineering, Universitas Indonesia",-,2018,9,1,Article,TAGUCHI- GREY RELATION BASED MULTI-RESPONSE OPTIMIZATION OF DIESEL ENGINE OPERATING PARAMETERS WITH WATER-IN-DIESEL EMULSION FUEL,Single Article missing,Missing content,-,-,Thomson Digital
Week-5,180201-003550,1-Feb-18,Journal,318818299,International Journal of Technology,J,"Faculty of Engineering, Universitas Indonesia",-,2018,9,1,Article,CRYSTAL STRUCTURE INVESTIGATION OF FERRITIC 73FE24CR2SI0.8MN0.1NI STEEL FOR MULTI-PURPOSE STRUCTURAL MATERIAL APPLICATIONS,Single Article missing,Missing content,-,-,Thomson Digital
Week-5,180201-003550,1-Feb-18,Journal,318818299,International Journal of Technology,J,"Faculty of Engineering, Universitas Indonesia",-,2018,9,1,Article,"EVENTS WITHIN AN EVENT, UNITS WITHIN A UNIT:
EXPLAINING THE STRUCTURE OF URBAN SPACES THROUGH NESTING THEORY",Single Article missing,Missing content,-,-,Thomson Digital
Week-5,180201-003550,1-Feb-18,Journal,318818299,International Journal of Technology,J,"Faculty of Engineering, Universitas Indonesia",-,2018,9,1,Article,VLSI CIRCUIT OPTIMIZATION FOR 8051 MCU,Single Article missing,Missing content,-,-,Thomson Digital
Week-5,180201-003550,1-Feb-18,Journal,318818299,International Journal of Technology,J,"Faculty of Engineering, Universitas Indonesia",-,2018,9,1,Article,OPTIMIZATION OF DRY STORAGE FOR SPENT FUEL FROM G.A. SIWABESSY NUCLEAR RESEARCH REACTOR,Single Article missing,Missing content,-,-,Thomson Digital
Week-5,180201-003550,1-Feb-18,Journal,318818299,International Journal of Technology,J,"Faculty of Engineering, Universitas Indonesia",-,2018,9,1,Article,A NEW PRECIPITATION-HARDENED AUSTENITIC STAINLESS STEEL INVESTIGATED BY ELECTRON MICROSCOPY,Single Article missing,Missing content,-,-,Thomson Digital
Week-5,180201-004088,1-Feb-18,Journal,318742399,International Journal of Law and Management,J,E-flow Emerald,-,2017,59,6,Article,"Does cultural value affect board
efficacy? Insights on international
corporate governance",Single Article missing,Missing content,-,-,Spi
Week-5,180201-002605,1-Feb-18,Journal,358117199,Biodiversitas,J,Society for Indonesian Biodiversity,-,2018,19,1,Article,"Diversity and habitat characteristics of macrozoobenthos in the
mangrove forest of Lubuk Kertang Village, North Sumatra, Indonesia",Single Article missing,Missing content,-,-,Spi
Week-5,180201-002587,1-Feb-18,Journal,77433599,Journal of Engineering Technology,J,American Society for Engineering Education,-,2018,6,1,Issue,-,Whole issue missing,Missing content,-,-,Innodata Isogen Inc
Week-5,180201-002754,1-Feb-18,Journal,298656699,"Asian Journal of Water, Environment and Pollution",J,E-flow IOS Press,-,2018,15,1,Issue,-,Whole issue missing,Missing content,-,-,Innodata Isogen Inc
Week-5,180127-004732,27-Jan-18,Journal,79627999,Chinese Journal of Cancer,J,E-flow BioMed Central,-,2017,36,1,Article,"Potential factors associated with clinical
stage of nasopharyngeal carcinoma
at diagnosis: a case–control study",Single Article missing,Missing content,-,-,Thomson Digital
Week-5,180127-004732,27-Jan-18,Journal,79419699,Asian Pacific Journal of Cancer Prevention,J,Asian Pacific Organization for Cancer Prevention,-,2016,17,Supplement3,Article,"Study of Relationship Between Illness Perception and Delay in Seeking
Help for Breast Cancer Patients Based on Leventhal’s Self-Regulation
Model",Single Article missing,Missing content,-,-,Thomson Digital
Week-5,180131-001279,31-Jan-18,Journal,290219699,Asian EFL Journal,J,Asian E F L Journal Press,-,2016,3,-,Issue,-,Whole issue missing,Missing content,-,-,Innodata Isogen Inc
Week-5,180131-005045,31-Jan-18,Journal,78336399,Egyptian Journal of Chemistry,J,NIDOC (Nat.Inform.Document.Centre),-,2017,60,3,Article,Modification of Waste Wool Fiber as Low Cost Adsorbent for The Removal of Methylene Blue from Aqueous Solution,Single Article missing,Missing content,-,-,Innodata Isogen Inc
Week-5,180201-005027,1-Feb-18,Journal,77043499,Current Organic Chemistry,J,E-flow Bentham Science Publishers Ltd,-,2016,21,2,Article,"Enzymatic Syntheses of Esters - Green Chemistry for Valuable Food, Fuel and Fine
Chemicals",Single Article missing,Missing content,-,-,Spi
Week-5,180129-004796,29-Jan-18,Journal,78739199,Man in India,J,Serials Publications,-,2017,97,22,Article,LAW AND SPORT: ACTUAL PROBLEMS,Single Article missing,Missing content,-,-,Innodata Isogen Inc
Week-5,180129-004864,29-Jan-18,Journal,78355599,"International Journal of Engineering, Transactions A: Basics",J,Materials and Energy Research Center,-,2018,31,1,Issue,-,Whole issue missing,Missing content,-,-,Innodata Isogen Inc
Week-5,180201-011926,1-Feb-18,Journal,77361199,Fusion Engineering and Design,J,E-Flow Elsevier,-,2017,123,-,Article,Experimental campaign on the upgraded He-FUS3 facility,Single Article missing,Missing content,-,-,Aptara
Week-5,180130-009000,30-Jan-18,Journal,78122599,Acoustical Physics,J,E-Flow Springer,-,2017,57,3-4,Issue,-,Whole issue missing,Missing content,-,-,Spi
Week-5,180130-006147,30-Jan-18,Journal,298817999,Trends in Carbohydrate Research,J,E-Flow PDF  Association of Carbohydrate Chemists and Technologists,-,2015,7,4,Issue,-,Whole issue missing,Missing content,-,-,Thomson Digital
Week-5,180130-007703,30-Jan-18,Journal,78739199,Man in India,J,Serials Publications,-,2017,97,22,Article,BUYING OR BROWSING: MOTIVATION BEHIND ONLINE PURCHASE INTENTION,Single Article missing,Missing content,-,-,Innodata Isogen Inc
Week-5,180130-007703,30-Jan-18,Journal,78739199,Man in India,J,Serials Publications,-,2017,97,22,Article,"IMPERATIVE VARIABLES, DISCRIMINATING THE INFLUENCE OF DERMATOLOGIST TOWARDS THE
USAGE OF FACIAL CREAM BRANDS",Single Article missing,Missing content,-,-,Innodata Isogen Inc
Week-5,180130-007703,30-Jan-18,Journal,78739199,Man in India,J,Serials Publications,-,2017,97,22,Article,HUMAN RESOURCE AUDITING: A PERCEPTUAL ANALYSIS OF MAHARATNA PUBLIC SECTOR UNIT OF INDIA,Single Article missing,Missing content,-,-,Innodata Isogen Inc
Week-5,180130-007703,30-Jan-18,Journal,79153699,International Journal of Applied Business and Economic Research,J,Serials Publications,-,2017,15,21,Article,Evidence of Effect of Perceived Risk on Online Shopping Cart Abandonment,Single Article missing,Missing content,-,-,Innodata Isogen Inc
Week-5,180130-007703,30-Jan-18,Journal,79153699,International Journal of Applied Business and Economic Research,J,Serials Publications,-,2017,15,21,Article,Viability of using Factor Analysis to Investigate the Impact on Purchase Experience with Facial Creams Among Women Professionals,Single Article missing,Missing content,-,-,Innodata Isogen Inc
Week-5,180130-007703,30-Jan-18,Journal,79167799,International Journal of Economic Research,J,Serials Publications,-,2017,14,16,Article,Constructs Influencing Satisfaction: A Comparative Analysis of Life Insurance Schemes Providers,Single Article missing,Missing content,-,-,Innodata Isogen Inc
Week-5,180201-010407,1-Feb-18,Journal,297249299,RSC Advances,J,E-Flow Royal Society of Chemistry,-,2016,6,36,Article,"Improving the dissolution of fenofibrate with yeast
cell-derived hollow core/shell carbon
microparticles",Single Article missing,Missing content,-,-,Innodata Isogen Inc
Week-5,180201-008615,1-Feb-18,Journal,78378899,PLoS Biology,J,Web Portal Public Library of Science,-,2018,16,1,Article,"Identification of osmoadaptive strategies in
the halophile, heterotrophic ciliate
Schmidingerothrix salinarum",Single Article missing,Missing content,-,-,SPI
Week-5,180130-002961,30-Jan-18,Journal,298817999,Trends in Carbohydrate Research,J,E-Flow PDF  Association of Carbohydrate Chemists and Technologists,-,2016,8,1,Issue,-,Whole issue missing,Missing content,-,-,Thomson Digital
Week-5,180201-007705,1-Feb-18,Journal,342663899,Journal of Advanced Research in Law and Economics,J,ASERS Publishing House,-,2016,7,6,Article,"International Standards in the Area of Combating the Financing of
Terrorism and Extremism",Single Article missing,Missing content,-,-,SPI
Week-5,180201-003315,1-Feb-18,Journal,259445699,Nature Communications,J,E-flow Nature Publishing Group,-,2017,8,-,Article,"A covalent PIN1 inhibitor selectively targets cancer
cells by a dual mechanism of action",Single Article missing,Missing content,-,-,Innodata Isogen Inc
Week-5,180130-009543,30-Jan-18,Journal,259427899,International Journal of Pure and Applied Mathematics,J,Academic Press,-,2017,113,6SpecialIssue,Article,"AN ALTERNATIVE ANALYTICAL
MODEL FOR PROPAGATION OF
TSUNAMI WAVES",Single Article missing,Missing content,-,-,Innodata Isogen Inc
Week-5,180130-009543,30-Jan-18,Journal,259427899,International Journal of Pure and Applied Mathematics,J,Academic Press,-,2017,114,6SpecialIssue,Article,"COMPLEX SOLUTIONS FOR
TSUNAMI-ASCENDING INTO A
RIVER AS A BORE",Single Article missing,Missing content,-,-,Innodata Isogen Inc
Week-5,180201-008431,1-Feb-18,Journal,79292499,International Journal of Economic Perspectives,J,E-flow PDF International Economic Society,-,2017,11,2,Article,Emotional Stability Development Conditions among Manager and Students,Single Article missing,Missing content,-,-,SPI
Week-5,180201-010288,1-Feb-18,Journal,632389511,Journal of Mechanical Engineering and Sciences,J,Universiti Malaysia Pahang,-,2017,11,3,Issue,-,Whole issue missing,Missing content,-,-,Innodata Isogen Inc
Week-5,180201-011018,1-Feb-18,Journal,295802099,International Journal of Applied Engineering Research,J,Research India Publications,-,2017,12,20,Article,Experimental Study of the Cooldown Process for Near-Wellbore Rocks at Sustained Extraction of Geothermal Energy,Single Article missing,Missing content,-,-,SPI
Week-5,180201-011369,1-Feb-18,Journal,78739199,Man in India,J,Serials Publications,-,2017,97,22,Article,A STUDY ON HEALTH INSURANCE WITH SPECIAL REFERENCE TO THE CITY OF CHENNAI,Single Article missing,Missing content,-,-,Innodata Isogen Inc
Week-5,180201-011450,1-Feb-18,Journal,78739199,Man in India,J,Serials Publications,-,2017,97,22,Article,STUDY OF DIFFERENCES BETWEEN THE GENDERS AMONG BANK EMPLOYEES TOWARDS INVESTMENT PREFERENCES AND BEHAVIOUR,Single Article missing,Missing content,-,-,Innodata Isogen Inc
Week-5,180131-011033,31-Jan-18,Journal,77306799,Brodogradnja,J,Web Portal Hrcak,-,1986,34,3,Issue,-,Whole issue missing,Missing content,-,-,SPI
Week-5,180128-001737,28-Jan-18,Journal,78551999,Journal of Product and Brand Management,J,E-flow Emerald,-,2016,25,7,Article,"Effectiveness of measures assessing response
to price information",Single Article missing,Missing content,-,-,SPI
Week-5,180128-001737,28-Jan-18,Journal,78551999,Journal of Product and Brand Management,J,E-flow Emerald,-,2016,25,7,Article,"Quantity consumer goods pricing: has
yesterday’s surcharge become
today’s discount?",Single Article missing,Missing content,-,-,SPI
Week-5,180128-001737,28-Jan-18,Journal,78551999,Journal of Product and Brand Management,J,E-flow Emerald,-,2016,25,7,Article,"Determinants of extended warranty prices
for consumer durables",Single Article missing,Missing content,-,-,SPI
Week-5,180128-001737,28-Jan-18,Journal,78551999,Journal of Product and Brand Management,J,E-flow Emerald,-,2016,25,7,Article,"Store equity and behavioral intentions: the
moderating role of the retailer’s technology",Single Article missing,Missing content,-,-,SPI
Week-5,180128-001737,28-Jan-18,Journal,78551999,Journal of Product and Brand Management,J,E-flow Emerald,-,2016,25,7,Article,"An unintended consequence of exaggerated
maximum-discount tensile price claims",Single Article missing,Missing content,-,-,SPI
Week-5,180128-001737,28-Jan-18,Journal,78551999,Journal of Product and Brand Management,J,E-flow Emerald,-,2016,25,7,Article,"How source of funds affects buyer’s
judgments of price fairness and
subsequent response",Single Article missing,Missing content,-,-,SPI
Week-5,180128-001737,28-Jan-18,Journal,78551999,Journal of Product and Brand Management,J,E-flow Emerald,-,2016,25,7,Article,"Brand marketing programs and consumer
loyalty – evidence from mobile phone users in
an emerging market",Single Article missing,Missing content,-,-,SPI
Week-5,180128-001737,28-Jan-18,Journal,78551999,Journal of Product and Brand Management,J,E-flow Emerald,-,2016,25,7,Article,"Nation branding for foreign direct investment:
an Integrative review and directions for
research and strategy",Single Article missing,Missing content,-,-,SPI
Week-5,180128-001737,28-Jan-18,Journal,78551999,Journal of Product and Brand Management,J,E-flow Emerald,-,2016,25,7,Article,"Resale prices in franchising: insights from
franchisee perspectives",Single Article missing,Missing content,-,-,SPI
Week-5,180128-001737,28-Jan-18,Journal,78551999,Journal of Product and Brand Management,J,E-flow Emerald,-,2016,25,7,Article,Editorial,Single Article missing,Missing content,-,-,SPI
Week-5,180201-008921,1-Feb-18,Journal,79169599,Pakistan Journal of Biotechnology,J,Pakistan Journal of Biotechnology,-,2017,14,SpecialIssue2,Article,THE TRENDS AND CHALLENGES IN BRAIN COMPUTER INTERFACE TECHNOLOGY – A COMPREHENSIVE STUDY,Single Article missing,Missing content,-,-,Innodata Isogen Inc
Week-5,180201-002919,1-Feb-18,Journal,259427899,International Journal of Pure and Applied Mathematics,J,Academic Press,-,2017,117,11SpecialIssue,Article,"Analysis of Batch Arrival Queueing System with
Two Types of Service and Two Types of Vacation",Single Article missing,Missing content,-,-,Innodata Isogen Inc
Week-5,180128-001762,28-Jan-18,Journal,294965599,RISTI - Revista Iberica de Sistemas e Tecnologias de Informacao,J,Associacao Iberica de Sistemas e Tecnologias de Informacao,-,2017,2017,25,Issue,-,Whole issue missing,Missing content,-,-,Thomson Digital
Week-5,180202-004664,2-Feb-18,Journal,79167799,International Journal of Economic Research,J,Serials Publications,-,2017,14,15,Article,Assessing Consumer Perception of the Value of Retail Chain Brands,Single Article missing,Missing content,-,-,Innodata Isogen Inc
Week-5,180202-004431,2-Feb-18,Journal,78065799,Italian Journal of Food Science,J,Chiriotti Editori,-,2015,2015,SpecialIssue,Article,QUALITY PARAMETERS OF WHOLEGRAIN DURUM WHEAT BREAD ENRICHED WITH CITRUS FIBRE,Single Article missing,Missing content,-,-,Innodata Isogen Inc
Week-5,180201-011611,1-Feb-18,Journal,310167199,Cauriensia,J,"Instituto Teologico  de Caceres, Universidad de Extremadura",-,2017,12,-,Article,SENTIDO E IMPLICACIONES DE LA SACRAMENTALIDAD DEL MATRIMONIO A LA LUZ DE AMORIS LAETITIA,Single Article missing,Missing content,-,-,Innodata Isogen Inc
Week-5,180201-006558,1-Feb-18,Journal,76938599,Experimental and Molecular Medicine,J,E-flow Nature Publishing Group,-,2017,49,9,Article,"Comparative global immune-related gene profiling of
somatic cells, human pluripotent stem cells and their
derivatives: implication for human lymphocyte
proliferation",Single Article missing,Missing content,-,-,Innodata Isogen Inc
Week-5,180202-004575,2-Feb-18,Journal,78059399,Journal of Enzyme Inhibition and Medicinal Chemistry,J,E-flow Taylor and Francis,-,2018,33,1,Article,"N-thioalkylcarbazoles derivatives as new antiproliferative
agents: synthesis, characterisation
and molecular mechanism evaluation",Single Article missing,Missing content,-,-,SPI
Week-5,180201-005375,1-Feb-18,Journal,76601699,European Review for Medical and Pharmacological Sciences,J,Verduci Editore s.r.l,-,2018,22,2,Issue,-,Whole issue missing,Missing content,-,-,Innodata Isogen Inc
Week-5,180202-004464,2-Feb-18,Journal,79167799,International Journal of Economic Research,J,Serials Publications,-,2017,14,15,Article,"Indicators and Indices of Sustainable Development of Administrative-Territorial Entities, Selection of Priority Objects of Standardization",Single Article missing,Missing content,-,-,Innodata Isogen Inc
Week-5,180202-004286,2-Feb-18,Journal,77144599,Journal of Transport Economics and Policy,J,University of Bath,-,2015,49,-,Article,"Does Benefit–Cost Efficiency Influence
Transport Investment Decisions?",Single Article missing,Missing content,-,-,Innodata Isogen Inc
Week-5,180202-003656,2-Feb-18,Journal,79901499,Journal of Applied Economic Sciences,J,ASERS Publishing House,-,2017,12,7,Issue,-,Whole issue missing,Missing content,-,-,SPI
Week-5,180201-003728,1-Feb-18,Journal,76531599,Neurology,J,E-flow Lippincott Williams and Wilkins,-,2018,90,4,Issue,-,Whole issue missing,Missing content,-,-,Innodata Isogen Inc
Week-5,180202-004087,2-Feb-18,Journal,290219199,Journal of Advanced Research in Dynamical and Control Systems,J,"Institute of Advanced Scientific Research, Inc.",-,2017,9,SpecialIssue18,Article,IMPLEMENTATION OF C-DEC PROTOCOL ALONG WITH SECTORIZATION CONCEPT FOR WIRELESS SENSOR NETWORKS,Single Article missing,Missing content,-,-,SPI
Week-5,180202-003617,2-Feb-18,Journal,79001799,Espacios,J,SciELO-Scientific Electronic Library Online,-,2017,38,62,Article,"Labor migrants and their families in the
Russian Far East: A sociological analysis",Single Article missing,Missing content,-,-,Thomson Digital
Week-5,180202-003669,2-Feb-18,Journal,301981299,Journal of Clinical and Experimental Dentistry,J,Medicina Oral S.L.,-,2018,10,2,Issue,-,Whole issue missing,Missing content,-,-,Thomson Digital
Week-5,180202-004319,2-Feb-18,Journal,290219199,Journal of Advanced Research in Dynamical and Control Systems,J,"Institute of Advanced Scientific Research, Inc.",-,2017,2017,SpecialIssue11,Article,Impact of Different Wind Turbine Generators on Radial Distribution System: Comparative Analysis,Single Article missing,Missing content,-,-,SPI
Week-5,180202-004861,2-Feb-18,Journal,663677953,International Journal of Mechanical and Production Engineering Research and Development,J,Transstellar Journal Publications and Research Consultancy Private Limited (TJPRC),-,2018,8,1,Article,"STUDY ON EFFECT OF CHENNAI METRO RAIL LIMITED
ROUTING SYSTEM AND ITS FUTURE GROWTH",Single Article missing,Missing content,-,-,SPI
Week-5,180202-004926,2-Feb-18,Journal,79642099,Pesquisa Brasileira em Odontopediatria e Clinica Integrada,J,Association of Support to Oral Health Research (APESB),-,2018,18,1,Article,Tackling the Wicked Health Problem of Early Childhood Caries,Single Article missing,Missing content,-,-,SPI
Week-5,180202-004325,2-Feb-18,Journal,79167799,International Journal of Economic Research,J,Serials Publications,-,2017,14,15,Article,Professional Competences of Personnel as a Factor of Forming Intellectual Capital of Business Entities,Single Article missing,Missing content,-,-,Innodata Isogen Inc
Week-5,180202-004680,2-Feb-18,Journal,76912199,Human Reproduction Update,J,E-flow Oxford University Press,-,2017,23,5,Article,"Baseline anatomical assessment of the
uterus and ovaries in infertile women:
a systematic review of the evidence
on which assessment methods are
the safest and most effective in terms
of improving fertility outcomes",Single Article missing,Missing content,-,-,Thomson Digital
Week-5,180127-002778,27-Jan-18,Journal,299950399,International Journal of Communication,J,University of Southern California,-,2016,10,-,Article,"The Business Push and Audience Pull
in Arab Entertainment Television",Single Article missing,Missing content,-,-,Thomson Digital
Week-5,180127-002778,27-Jan-18,Journal,299950399,International Journal of Communication,J,University of Southern California,-,2016,10,-,Article,"Questioning Global Communication Power
Introduction",Single Article missing,Missing content,-,-,Thomson Digital
Week-5,180129-003402,29-Jan-18,Journal,78739499,Mini-Reviews in Organic Chemistry,J,E-flow Bentham Science Publishers Ltd,-,2017,14,4,Article,Multi-target Activities of Selected Alkaloids and Terpen oids,Single Article missing,Missing content,-,-,SPI
Week-5,180202-001279,2-Feb-18,Journal,295802099,International Journal of Applied Engineering Research,J,Research India Publications,-,2017,12,22,Article,Two Phase Hybrid AI-Heuristics for Multiple Travelling Salesman Problem,Single Article missing,Missing content,-,-,SPI
Week-5,180202-002362,2-Feb-18,Journal,312199499,Analytical and Bioanalytical Electrochemistry,J,"Center of Excellence in Electrochemistry, Univ. of Tehran",-,2018,10,1,Article,"Electropolymerization of Proline Supported beta Cyclodextrin inside Amino Functionalized Magnetic Mesoporous Silica Nanomaterial: One Step Preparation, Characterization and Electrochemical Application",Single Article missing,Missing content,-,-,SPI
Week-5,180202-003067,2-Feb-18,Journal,76772399,Biomedical Research (India),J,Scientific Publishers of India,-,2017,2017,SpecialIssue,Article,"Meta-data based secret image sharing application for different sized biomedical
images",Single Article missing,Missing content,-,-,Spi
Week-5,180129-003265,29-Jan-18,Journal,295678699,Siberian Electronic Mathematical Reports,J,Sobolev Institute of Mathematics,-,2017,14,-,Article,"VISCOUS COMPRESSIBLE HOMOGENEOUS MULTI-FLUIDS
WITH MULTIPLE VELOCITIES:
BAROTROPIC EXISTENCE THEORY",Single Article missing,Missing content,-,-,Thomson Digital
Week-5,180129-003369,29-Jan-18,Journal,295678699,Siberian Electronic Mathematical Reports,J,Sobolev Institute of Mathematics,-,2016,13,-,Article,Solubility of steady boundary value problem for the equations of polytropic motion of multicomponent viscous compressible fluids,Single Article missing,Missing content,-,-,Thomson Digital
Week-5,180131-006017,31-Jan-18,Journal,79153699,International Journal of Applied Business and Economic Research,J,Serials Publications,-,2017,15,21,Article,A Study on the Adoption of Perceived Risk and Perceived Benefit on Mobile Banking,Single Article missing,Missing content,-,-,Innodata Isogen Inc
Week-5,180131-006017,31-Jan-18,Journal,78739199,Man in India,J,Serials Publications,-,2017,97,22,Article,CORPORATE SOCIAL RESPONSIBILITY CAMPAIGNS ON BRAND IMAGE AND CONSUMER PURCHASE INTENTION,Single Article missing,Missing content,-,-,Innodata Isogen Inc
Week-5,180131-006017,31-Jan-18,Journal,78739199,Man in India,J,Serials Publications,-,2017,97,22,Article,A STUDY ON JOB STRESS ON JOB PERFORMANCE OF PRIVATE SECTOR EMPLOYEE,Single Article missing,Missing content,-,-,Innodata Isogen Inc
Week-5,180131-006017,31-Jan-18,Journal,78739199,Man in India,J,Serials Publications,-,2017,97,22,Article,THE INFLUENCE OF NIGHT SHIFTS ON THE QUALITY OF MARITAL LIFE,Single Article missing,Missing content,-,-,Innodata Isogen Inc
Week-5,180202-000143,2-Feb-18,Journal,79934899,Frontiers in Cellular Neuroscience,J,Frontiers Research Foundation,-,2017,11,-,Article,VGLUT2 Trafficking Is Differentially Regulated by Adaptor Proteins AP-1 and AP-3,Single Article missing,Missing content,-,-,Spi
Week-5,180201-008850,1-Feb-18,Journal,77996399,Mathematical Problems in Engineering,J,E-Flow Hindawi Publishing,-,2018,2018,-,Article,"Transportation Service Procurement Bid Construction
Problem from Less Than Truckload Perspective",Single Article missing,Missing content,-,-,Innodata Isogen Inc
Week-5,180201-003856,1-Feb-18,Journal,79811799,Journal of Grey System,J,Research Information Ltd,-,2017,29,4,Issue,-,Whole issue missing,Missing content,-,-,Innodata Isogen Inc
Week-5,180130-008727,30-Jan-18,Journal,78065699,Industrie Alimentari,J,Chiriotti Editori,-,2017,56,583,Issue,-,Whole issue missing,Missing content,-,-,Innodata Isogen Inc
Week-5,180202-002151,2-Feb-18,Journal,77571499,Smart Materials and Structures,J,Web Portal IOP,-,2010,19,8,Article,"Fuselage panel noise attenuation by
piezoelectric switching control",Single Article missing,Missing content,-,-,Innodata Isogen Inc
Week-5,180201-004866,1-Feb-18,Journal,661922422,International Journal of Engineering and Technology(UAE),J,Science Publishing Corporation Inc,-,2018,7,1,Article,Applying metric space and pivot-based indexing on combined features of bio-images for fast execution of composite queries,Single Article missing,Missing content,-,-,Thomson Digital
Week-5,180130-001023,30-Jan-18,Journal,259427899,International Journal of Pure and Applied Mathematics,J,Academic Press,-,2017,113,10SpecialIssue,Article,"PRIME CORDIAL AND SIGNED PRODUCT
CORDIAL LABELING FOR THE
EXTENDED DUPLICATE GRAPH OF
ARROW GRAPH",Single Article missing,Missing content,-,-,Innodata Isogen Inc
Week-5,180201-007800,1-Feb-18,Journal,78702799,Plant Pathology Journal,J,Korean Society of Plant Pathology,-,2017,16,2,Issue,-,Whole issue missing,Missing content,-,-,Spi
Week-5,180202-005791,2-Feb-18,Journal,78193899,Monthly Notices of the Royal Astronomical Society,J,E-flow Oxford University Press,-,2018,473,3,Article,"NuSTAR spectral analysis of two bright Seyfert 1 galaxies: MCG
+8-11-11 and NGC 6814",Single Article missing,Missing content,-,-,Thomson Digital
