Week,DPR no.,Report Date,Medium,Source ID ,Source title ,Source type,Content provider,No. of Correction,Pub year,Volume ,Issue,Article/Iss,Article title,Correction Field,Correction Type,Sub KPI,Precision/Recall,CAR Supplier
Week-5,180130-001023,30-Jan-18,Journal,259427899,International Journal of Pure and Applied Mathematics,J,Academic Press,-,2017,113,SpecialIssue,Article,"PRIME CORDIAL AND SIGNED PRODUCT
CORDIAL LABELING FOR THE
EXTENDED DUPLICATE GRAPH OF
ARROW GRAPH",Single Article missing,Missing content,-,-,Innodata Isogen Inc
Week-5,180201-007800,1-Feb-18,Journal,78702799,Plant Pathology Journal,J,Korean Society of Plant Pathology,-,2017,16,2,Issue,-,Whole issue missing,Missing content,-,-,Spi
Week-5,180202-005791,2-Feb-18,Journal,78193899,Monthly Notices of the Royal Astronomical Society,J,E-flow Oxford University Press,-,2018,473,3,Article,"NuSTAR spectral analysis of two bright Seyfert 1 galaxies: MCG
+8-11-11 and NGC 6814",Single Article missing,Missing content,-,-,Thomson Digital
Week-5,180202-005820,2-Feb-18,Journal,78193899,Monthly Notices of the Royal Astronomical Society,J,E-flow Oxford University Press,-,2018,473,2,Article,"NuSTAR + XMM-Newton monitoring of the neutron star transient
AX J1745.6-2901",Single Article missing,Missing content,-,-,Thomson Digital
Week-5,180130-003757,30-Jan-18,Journal,298817299,Scientific Reports,J,E-flow Nature Publishing Group,-,2017,7,1,Article,"The mediating role of sleep in
the fish consumption – cognitive
functioning relationship: a cohort
study",Single Article missing,Missing content,-,-,Innodata Isogen Inc
Week-5,180129-003776,29-Jan-18,Journal,76273299,Biological Psychology,J,E-Flow Elsevier,-,2018,132,-,Article,"Conflict between gesture representations extinguishes ? rhythm
desynchronization during manipulable object perception: An EEG study",Single Article missing,Missing content,-,-,Aptara
Week-5,180201-012556,1-Feb-18,Journal,76242199,Annals of the Rheumatic Diseases,J,E-flow BMJ Publishing Group,-,2018,77,1,Article,"The EuroMyositis registry: an international
collaborative tool to facilitate myositis research",Single Article missing,Missing content,-,-,Innodata Isogen Inc
Week-5,180202-000703,2-Feb-18,Journal,77444399,Journal of Physical Chemistry A,J,E-flow ACS (American Chemical Society),-,2016,120,50,Article,"Site-Specific Electron-Relaxation Caused by Si:2p Core-Level
Photoionization: Comparison between F3SiCH2CH2Si(CH3)3 and
Cl3SiCH2CH2Si(CH3)3 Vapors by Means of Photoelectron Auger
Electron Coincidence Spectroscopy",Single Article missing,Missing content,-,-,Innodata Isogen Inc
Week-5,180130-009308,30-Jan-18,Journal,76871899,Endocrine-Related Cancer,J,BioScientifica Ltd,-,2017,25,2,Article,"TSC2 rare germline variants in non-tuberous
sclerosis patients with neuroendocrine
neoplasias",Single Article missing,Missing content,-,-,Innodata Isogen Inc
Week-5,180202-002712,2-Feb-18,Journal,78962099,Reviews on Recent Clinical Trials,J,E-flow Bentham Science Publishers Ltd,-,2018,13,1,Article,"The Emerging Role of Complement C3 as A Biomarker of Insulin
Resistance and Cardiometabolic Diseases: Preclinical and Clinical
Evidence",Single Article missing,Missing content,-,-,Spi
Week-5,180129-004920,29-Jan-18,Journal,78739199,Man in India,J,Serials Publications,-,2018,97,22,Article,PERSONAL FACTORS OF TEACHERS MOTIVATIONAL READINESS FOR INNOVATION,Single Article missing,Missing content,-,-,Innodata Isogen Inc
Week-5,180129-004920,29-Jan-18,Journal,78739199,Man in India,J,Serials Publications,-,2018,97,22,Article,SPECIFICS OF EMOTIONAL BURNOUT IN OFFICE WORKERS,Single Article missing,Missing content,-,-,Innodata Isogen Inc
Week-5,180129-010170,29-Jan-18,Journal,79133699,Biotechnology for Biofuels,J,E-flow BioMed Central,-,2017,10,1,Article,"Predicting the most appropriate wood
biomass for selected industrial applications:
comparison of wood, pulping, and enzymatic
treatments using fluorescent?tagged
carbohydrate?binding modules",Single Article missing,Missing content,-,-,Innodata Isogen Inc
Week-5,180129-010092,29-Jan-18,Journal,78099299,Molecules,J,MDPI AG,-,2017,22,7,Article,"Akanthopyrones A–D,  -Pyrones Bearing a
4-O-Methyl- -D-glucopyranose Moiety from the
Spider-Associated Ascomycete
Akanthomyces novoguineensis",Single Article missing,Missing content,-,-,Innodata Isogen Inc
Week-5,180129-009531,29-Jan-18,Journal,295802099,International Journal of Applied Engineering Research,J,Research India Publications,-,2017,12,23,Article,The Calculation of the Diffraction Integral Using Chebyshev Polynomials,Single Article missing,Missing content,-,-,SPI
Week-5,180129-008926,29-Jan-18,Journal,78739199,Man in India,J,Serials Publications,-,2017,97,22,Article,FEATURES OF MASTERING THE MODERN MUSICAL CONTINUUM BY THE YOUTH AUDIENCE IN RUSSIA,Single Article missing,Missing content,-,-,Innodata Isogen Inc
Week-5,180129-008926,29-Jan-18,Journal,78739199,Man in India,J,Serials Publications,-,2017,97,22,Article,"PUBLICISM ABOUT INDEPENDENCE BY ABISH KEKILBAYULY: DEPENDENCE, INDEPENDENCE
AND FUTURE OF THE KAZAKH NATION",Single Article missing,Missing content,-,-,Innodata Isogen Inc
Week-5,180129-008926,29-Jan-18,Journal,78739199,Man in India,J,Serials Publications,-,2017,97,22,Article,PEDAGOGICAL SUPPORT FOR THE DEVELOPMENT OF THE INTELLECTUAL- CREATIVE POTENTIAL OF YOUNGER SCHOOL CHILDREN,Single Article missing,Missing content,-,-,Innodata Isogen Inc
Week-5,180129-008926,29-Jan-18,Journal,78739199,Man in India,J,Serials Publications,-,2017,97,22,Article,PSYCHOLOGICAL FEATURES OF PERSONALITY OF THE ALCOHOL-DEPENDENT EMPLOYEES OF THE MINISTRY OF INTERNAL AFFAIRS,Single Article missing,Missing content,-,-,Innodata Isogen Inc
Week-5,180129-008926,29-Jan-18,Journal,78739199,Man in India,J,Serials Publications,-,2017,97,22,Article,MODERN METHODS OF TEACHING RUSSIAN AS A FOREIGN LANGUAGE TO NON-PHILOLOGY STUDENTS,Single Article missing,Missing content,-,-,Innodata Isogen Inc
Week-5,180129-008926,29-Jan-18,Journal,78739199,Man in India,J,Serials Publications,-,2017,97,22,Article,LEGAL CONFLICTS RESOLUTION IN CUSTOMARY LAW OF PEOPLES OF THE WORLD,Single Article missing,Missing content,-,-,Innodata Isogen Inc
Week-5,180129-009061,29-Jan-18,Journal,78739199,Man in India,J,Serials Publications,-,2017,97,22,Article,THE EXPLICATION OF RELIGIOUS EXPERIENCE,Single Article missing,Missing content,-,-,Innodata Isogen Inc
Week-5,180129-014279,29-Jan-18,Journal,78253599,Complexity,J,E-Flow Hindawi Publishing,-,2017,2017,-,Article,"Mining Community-Level Influence in Microblogging Network:
A Case Study on Sina Weibo",Single Article missing,Missing content,-,-,Innodata Isogen Inc
Week-5,180129-014141,29-Jan-18,Journal,79584799,Security and Communication Networks,J,E-Flow Hindawi Publishing,-,2017,2017,-,Article,"ABS-TrustSDN: An Agent-Based Simulator of Trust
Strategies in Software-Defined Networks",Single Article missing,Missing content,-,-,Innodata Isogen Inc
Week-5,180129-013355,29-Jan-18,Journal,78739199,Man in India,J,Serials Publications,-,2017,97,22,Article,"“SCYTHIAN STRATEGY” OR OPEN PITCHED BATTLE: CHOICE OF STRATEGY BY THE PERSIAN COMMAND
IN 334 BC",Single Article missing,Missing content,-,-,Innodata Isogen Inc
Week-5,180129-013207,29-Jan-18,Journal,78739199,Man in India,J,Serials Publications,-,2017,97,22,Article,SPECIFICITY OF CRITICAL THINKINGIN THE DISCOURSE ANALYSIS,Single Article missing,Missing content,-,-,Innodata Isogen Inc
Week-5,180129-012887,29-Jan-18,Journal,77107799,"Geografiska Annaler, Series A: Physical Geography",J,E-flow Taylor and Francis,-,2017,99,4,Issue,-,Whole issue missing,Missing content,-,-,Spi
Week-5,180129-012636,29-Jan-18,Journal,323443599,Journal of Environmental Health Science and Engineering,J,E-flow BioMed Central,-,2017,15,1,Article,"Removal of precursors and disinfection byproducts
(DBPs) by membrane filtration
from water; a review",Single Article missing,Missing content,-,-,Innodata Isogen Inc
Week-5,180129-002999,29-Jan-18,Journal,79153699,International Journal of Applied Business and Economic Research,J,Serials Publications,-,2017,15,25,Article,"Service Quality and Customers’ Satisfaction level in
Telecommunication Sector: A Comparative Study of Kingdom of
Saudi Arabia & India",Single Article missing,Missing content,-,-,Innodata Isogen Inc
Week-5,180129-002022,29-Jan-18,Journal,290219199,Journal of Advanced Research in Dynamical and Control Systems,J,"Institute of Advanced Scientific Research, Inc.",-,2017,9,-,Article,EXPERIMENTAL EVALUATION OF ASSOCIATION RULE IN APRIORI AND ANT COLONY OPTIMIZATION,Single Article missing,Missing content,-,-,Spi
Week-5,180129-001887,29-Jan-18,Journal,77323999,Computer Applications in Engineering Education,J,E-flow Wiley Blackwell,-,2017,25,5,Article,"Computer programming with Python for industrial and systems
engineers: Perspectives from an instructor and students",Single Article missing,Missing content,-,-,Spi
Week-5,180128-001746,28-Jan-18,Journal,78488599,Iranian Journal of Public Health,J,Iranian Journal of Public Health,-,2004,33,1,Issue,-,Whole issue missing,Missing content,-,-,Spi
Week-5,180127-004213,27-Jan-18,Journal,661889560,Acta Baltica Historiae et Philosophiae Scientiarum,J,Estonian Association for the History and Philosophy of Science,-,2017,5,2,Issue,-,Whole issue missing,Missing content,-,-,Innodata Isogen Inc
Week-5,180127-003471,27-Jan-18,Journal,294115599,Studia z Filologii Polskiej i Slowianskiej,J,"Institute of Slavic Studies, Polish Academy of Sciences",-,2015,50,-,Article,"Can the presently created Kashubian literary
language and the currently formed new Breton
language be objects of consideration for researchers
of the linguistic picture of the world?",Single Article missing,Missing content,-,-,Innodata Isogen Inc
Week-5,180127-003471,27-Jan-18,Journal,294115599,Studia z Filologii Polskiej i Slowianskiej,J,"Institute of Slavic Studies, Polish Academy of Sciences",-,2015,50,-,Article,-,Single Article missing,Missing content,-,-,Innodata Isogen Inc
Week-5,180127-003471,27-Jan-18,Journal,294115599,Studia z Filologii Polskiej i Slowianskiej,J,"Institute of Slavic Studies, Polish Academy of Sciences",-,2015,50,-,Article,-,Single Article missing,Missing content,-,-,Innodata Isogen Inc
Week-5,180127-003471,27-Jan-18,Journal,294115599,Studia z Filologii Polskiej i Slowianskiej,J,"Institute of Slavic Studies, Polish Academy of Sciences",-,2015,50,-,Article,-,Single Article missing,Missing content,-,-,Innodata Isogen Inc
Week-5,180127-003471,27-Jan-18,Journal,294115599,Studia z Filologii Polskiej i Slowianskiej,J,"Institute of Slavic Studies, Polish Academy of Sciences",-,2015,50,-,Article,-,Single Article missing,Missing content,-,-,Innodata Isogen Inc
Week-5,180127-003471,27-Jan-18,Journal,294115599,Studia z Filologii Polskiej i Slowianskiej,J,"Institute of Slavic Studies, Polish Academy of Sciences",-,2015,50,-,Article,-,Single Article missing,Missing content,-,-,Innodata Isogen Inc
Week-5,180127-003471,27-Jan-18,Journal,294115599,Studia z Filologii Polskiej i Slowianskiej,J,"Institute of Slavic Studies, Polish Academy of Sciences",-,2015,50,-,Article,-,Single Article missing,Missing content,-,-,Innodata Isogen Inc
Week-5,180129-002667,29-Jan-18,Journal,77783199,Molecular Plant Pathology,J,E-flow Wiley Blackwell,-,2018,19,1,Article,The enemy within: phloem-limited pathogens,Single Article missing,Missing content,-,-,Spi
Week-5,180127-001492,27-Jan-18,Journal,79772299,Nature Reviews Rheumatology,J,E-flow Nature Publishing Group,-,2017,13,10,Issue,-,Whole issue missing,Missing content,-,-,Innodata Isogen Inc
Week-5,180201-000737,1-Feb-18,Journal,79042199,Journal of Computer Science,J,Science Publications,-,2017,13,9,Article,"A Randomized Population Constructive Heuristic for the
Team Orienteering Problem",Single Article missing,Missing content,-,-,Thomson Digital
Week-5,180201-002543,1-Feb-18,Journal,295802099,International Journal of Applied Engineering Research,J,Research India Publications,-,2017,12,22,Article,Extended Median Filter For Salt and Pepper Noise In Image,Single Article missing,Missing content,-,-,Spi
Week-5,180201-002543,1-Feb-18,Journal,295802099,International Journal of Applied Engineering Research,J,Research India Publications,-,2017,12,21,Article,A Feasibility Study on Energy Saving through Reclaiming Excess Condensed Water into Cooling Tower Circulation,Single Article missing,Missing content,-,-,Spi
Week-5,180201-002543,1-Feb-18,Journal,295802099,International Journal of Applied Engineering Research,J,Research India Publications,-,2017,12,20,Article,Web-Based Numerical Algorithm Library: A Review,Single Article missing,Missing content,-,-,Spi
Week-5,180201-002543,1-Feb-18,Journal,295802099,International Journal of Applied Engineering Research,J,Research India Publications,-,2017,12,18,Article,Multi Algorithms for Improving Leukemia Images Edge Detection Technique,Single Article missing,Missing content,-,-,Spi
Week-5,180202-009500,2-Feb-18,Journal,263689399,Monthly Notices of the Royal Astronomical Society: Letters,J,E-flow Oxford University Press,-,2017,468,1,Article,The nature of the Lyman ? emitter CR7: a persisting puzzle,Single Article missing,Missing content,-,-,Thomson Digital
Week-5,180201-013982,1-Feb-18,Journal,79608899,Energies,J,MDPI AG,-,2018,11,2,Article,"Thermodynamic Performance Assessment of a Novel
Micro-CCHP System Based on a Low Temperature
PEMFC Power Unit and a Half-Effect Li/Br
Absorption Chiller",Single Article missing,Missing content,-,-,Innodata Isogen Inc
Week-5,180201-010599,1-Feb-18,Journal,77923399,Progress in Nutrition,J,Mattioli 1885,-,2017,19,4,Issue,-,Whole issue missing,Missing content,-,-,Innodata Isogen Inc
Week-5,180201-007911,1-Feb-18,Journal,663677953,International Journal of Mechanical and Production Engineering Research and Development,J,Transstellar Journal Publications and Research Consultancy Private Limited (TJPRC),-,2018,8,1,Article,"COMPARISON OF WALL TEMPERATURES ON SCRAMJET INLETS
AT HYPERSONIC VELOCITIES",Single Article missing,Missing content,-,-,Spi
Week-5,180201-007911,1-Feb-18,Journal,663677953,International Journal of Mechanical and Production Engineering Research and Development,J,Transstellar Journal Publications and Research Consultancy Private Limited (TJPRC),-,2018,8,1,Article,"MULTI OBJECTIVE OPTIMIZATION OF LAMINAR MIXED CONVECTIVE
HEAT TRANSFER OF ELECTRONIC CHIPS IN A HORIZONTAL
CHANNEL WITH VORTEX GENERATOR",Single Article missing,Missing content,-,-,Spi
Week-5,180201-007911,1-Feb-18,Journal,663677953,International Journal of Mechanical and Production Engineering Research and Development,J,Transstellar Journal Publications and Research Consultancy Private Limited (TJPRC),-,2018,8,1,Article,BIOMETRIC BASED STUDENTS BUS MANAGEMENT SYSTEM,Single Article missing,Missing content,-,-,Spi
Week-5,180201-007911,1-Feb-18,Journal,663677953,International Journal of Mechanical and Production Engineering Research and Development,J,Transstellar Journal Publications and Research Consultancy Private Limited (TJPRC),-,2018,8,1,Article,"DESIGN AND MODELING STUDIES OF TUBE END EXPANSION USING
RESPONSE SURFACE METHODOLOGY",Single Article missing,Missing content,-,-,Spi
Week-5,180201-007911,1-Feb-18,Journal,663677953,International Journal of Mechanical and Production Engineering Research and Development,J,Transstellar Journal Publications and Research Consultancy Private Limited (TJPRC),-,2018,8,1,Article,"PERFORMANCE AND EMISSION CHARACTERISTICS OF CASHEW NUT SHELL
PYROLYSED OIL – WASTE COOKING OIL WITH DIESEL FUEL
IN A FOUR STOKE DI DIESEL ENGINE",Single Article missing,Missing content,-,-,Spi
Week-5,180201-007911,1-Feb-18,Journal,663677953,International Journal of Mechanical and Production Engineering Research and Development,J,Transstellar Journal Publications and Research Consultancy Private Limited (TJPRC),-,2018,8,1,Article,RFID BASED STUDENT’S BUS MONITORING SYSTEM,Single Article missing,Missing content,-,-,Spi
Week-5,180201-007911,1-Feb-18,Journal,663677953,International Journal of Mechanical and Production Engineering Research and Development,J,Transstellar Journal Publications and Research Consultancy Private Limited (TJPRC),-,2018,8,1,Article,STRESS ANALYSIS OF HIGH SPEED FOUR BAR MECHANISM,Single Article missing,Missing content,-,-,Spi
Week-5,180201-007911,1-Feb-18,Journal,663677953,International Journal of Mechanical and Production Engineering Research and Development,J,Transstellar Journal Publications and Research Consultancy Private Limited (TJPRC),-,2018,8,1,Article,"A CASE STUDY OF REVERSE ENGINEERING INTEGRATED IN AN ANCIENT
INDIAN ALCHEMICAL ALLOYING W. S. R TO AU-CU-ZN ALLOY
USING PART- WHOLE SCHEMA",Single Article missing,Missing content,-,-,Spi
Week-5,180201-007911,1-Feb-18,Journal,663677953,International Journal of Mechanical and Production Engineering Research and Development,J,Transstellar Journal Publications and Research Consultancy Private Limited (TJPRC),-,2018,8,1,Article,A REVIEW ON NON-CIRCULAR JOURNAL BEARINGS,Single Article missing,Missing content,-,-,Spi
Week-5,180201-007911,1-Feb-18,Journal,663677953,International Journal of Mechanical and Production Engineering Research and Development,J,Transstellar Journal Publications and Research Consultancy Private Limited (TJPRC),-,2018,8,1,Article,"AN INVESTIGATION OF COMPARATIVE STUDY IN CONNECTING
ROD BY USING FINITE ELEMENT ANALYSIS",Single Article missing,Missing content,-,-,Spi
Week-5,180201-007911,1-Feb-18,Journal,663677953,International Journal of Mechanical and Production Engineering Research and Development,J,Transstellar Journal Publications and Research Consultancy Private Limited (TJPRC),-,2018,8,1,Article,"ANALYSIS OF FUZZY SOFT SET COMPOSITIONS FOR ALLOCATING JOBS
TO MACHINES IN FUZZY ENVIRONMENT",Single Article missing,Missing content,-,-,Spi
Week-5,180201-007911,1-Feb-18,Journal,663677953,International Journal of Mechanical and Production Engineering Research and Development,J,Transstellar Journal Publications and Research Consultancy Private Limited (TJPRC),-,2018,8,1,Article,"ANALYSIS OF THE INFLUENCE OF FRICTION STIR PROCESSING ON GAS
TUNGSTEN ARC WELDING OF 2024 ALUMINUM ALLOY WELD ZONE",Single Article missing,Missing content,-,-,Spi
Week-5,180201-007911,1-Feb-18,Journal,663677953,International Journal of Mechanical and Production Engineering Research and Development,J,Transstellar Journal Publications and Research Consultancy Private Limited (TJPRC),-,2018,8,1,Article,"DEFECTS OF COMMUNICATION PIPES FROM PLASTIC IN
MODERN CIVIL ENGINEERING",Single Article missing,Missing content,-,-,Spi
Week-5,180201-007911,1-Feb-18,Journal,663677953,International Journal of Mechanical and Production Engineering Research and Development,J,Transstellar Journal Publications and Research Consultancy Private Limited (TJPRC),-,2018,8,1,Article,"DESIGN AND DEVELOPMENT OF CARTESIAN CO-ORDINATE
BASED 3D PRINTER",Single Article missing,Missing content,-,-,Spi
Week-5,180201-007911,1-Feb-18,Journal,663677953,International Journal of Mechanical and Production Engineering Research and Development,J,Transstellar Journal Publications and Research Consultancy Private Limited (TJPRC),-,2018,8,1,Article,"EFFECT OF GLOBAL SOLAR RADIATION ON THE HEAT TRANSFER AND
PRESSURE DROP CHARACTERISTICS OF DOUBLE
FLOW PACKED BED SOLAR AIR HEATER",Single Article missing,Missing content,-,-,Spi
Week-5,180201-007911,1-Feb-18,Journal,663677953,International Journal of Mechanical and Production Engineering Research and Development,J,Transstellar Journal Publications and Research Consultancy Private Limited (TJPRC),-,2018,8,1,Article,"FLUID-STRUCTURE INTERACTION ANALYSIS ON HORIZONTAL
WIND TURBINE BLADE",Single Article missing,Missing content,-,-,Spi
Week-5,180201-007911,1-Feb-18,Journal,663677953,International Journal of Mechanical and Production Engineering Research and Development,J,Transstellar Journal Publications and Research Consultancy Private Limited (TJPRC),-,2018,8,1,Article,"NUMERICAL INVESTIGATION OF THE DROP FORMATION MECHANISM
AND STUDY OF THE DROPLET’S PRESSURE CONTOUR",Single Article missing,Missing content,-,-,Spi
Week-5,180201-007911,1-Feb-18,Journal,663677953,International Journal of Mechanical and Production Engineering Research and Development,J,Transstellar Journal Publications and Research Consultancy Private Limited (TJPRC),-,2018,8,1,Article,"NUMERICAL SIMULATION ON FLOW PAST FOUR CIRCULAR CYLINDERS IN
DIAMOND AND SQUARE ARRANGEMENT",Single Article missing,Missing content,-,-,Spi
Week-5,180201-007911,1-Feb-18,Journal,663677953,International Journal of Mechanical and Production Engineering Research and Development,J,Transstellar Journal Publications and Research Consultancy Private Limited (TJPRC),-,2018,8,1,Article,"PERFORMANCE EVALUATION OF VCR CI ENGINE USING C-D INTAKE
MANIFOLD WITH INTERNAL GROOVING",Single Article missing,Missing content,-,-,Spi
Week-5,180201-007911,1-Feb-18,Journal,663677953,International Journal of Mechanical and Production Engineering Research and Development,J,Transstellar Journal Publications and Research Consultancy Private Limited (TJPRC),-,2018,8,1,Article,"STRESS ANALYSIS ON COMMERCIAL AIRCRAFT
WINDOW BLEED (TINY) HOLE",Single Article missing,Missing content,-,-,Spi
Week-5,180201-007911,1-Feb-18,Journal,663677953,International Journal of Mechanical and Production Engineering Research and Development,J,Transstellar Journal Publications and Research Consultancy Private Limited (TJPRC),-,2018,8,1,Article,"MODAL AND HARMONIC ANALYSIS OF A CANTILVER BEAM
WITH DIFFERRENT CROSS-SECTIONS",Single Article missing,Missing content,-,-,Spi
Week-5,180201-007911,1-Feb-18,Journal,663677953,International Journal of Mechanical and Production Engineering Research and Development,J,Transstellar Journal Publications and Research Consultancy Private Limited (TJPRC),-,2018,8,1,Article,"EFFECT OF MACHINE SPEED ON YARN INPUT TENSION AND ‘ON-MACHINE’
COURSE LENGTH FOR A CIRCULAR WEFT KNITTING MACHINE WITH
POSITIVE STORAGE FEEDING",Single Article missing,Missing content,-,-,Spi
Week-5,180201-007911,1-Feb-18,Journal,663677953,International Journal of Mechanical and Production Engineering Research and Development,J,Transstellar Journal Publications and Research Consultancy Private Limited (TJPRC),-,2018,8,1,Article,"HEAT AND MASS TRANSFER ANALYSIS OF STEADY MHD FREE CONVECTIVE
FLUID FLOW PAST AN INCLINED STRETCHING POROUS SHEET WITH
VISCOUS DISSIPATION AND RADIATION",Single Article missing,Missing content,-,-,Spi
Week-5,180201-007911,1-Feb-18,Journal,663677953,International Journal of Mechanical and Production Engineering Research and Development,J,Transstellar Journal Publications and Research Consultancy Private Limited (TJPRC),-,2018,8,1,Article,"OPTIMIZATION OF PROCESS PARAMETERS OF FRICTION STIR WELDING
OF AA 6082-T6 USING GREY BASED TAGUCHI METHOD",Single Article missing,Missing content,-,-,Spi
Week-5,180201-007911,1-Feb-18,Journal,663677953,International Journal of Mechanical and Production Engineering Research and Development,J,Transstellar Journal Publications and Research Consultancy Private Limited (TJPRC),-,2018,8,1,Article,"THE EFFECTS OF TiC REINFORCEMENT ON THERMAL, ELECTRICAL AND
DRY SLIDING WEAR BEHAVIOUR OF ALUMINIUM MATRIX
NANOCOMPOSITES",Single Article missing,Missing content,-,-,Spi
Week-5,180201-007911,1-Feb-18,Journal,663677953,International Journal of Mechanical and Production Engineering Research and Development,J,Transstellar Journal Publications and Research Consultancy Private Limited (TJPRC),-,2018,8,1,Article,"THEORETICAL CORROBORATION OF THE SELECTION CRITERIA OF THE
BREAKING-IN AND SHAPE-COPY GEAR TEETH GRINDING METHODS",Single Article missing,Missing content,-,-,Spi
Week-5,180201-007911,1-Feb-18,Journal,663677953,International Journal of Mechanical and Production Engineering Research and Development,J,Transstellar Journal Publications and Research Consultancy Private Limited (TJPRC),-,2018,8,1,Article,"EVALUATION OF INTERLAMINAR FRACTURE TOUGHNESS OF GLASS
FIBER - EPOXY-MODIFIED COMPOSITE MATERIALS",Single Article missing,Missing content,-,-,Spi
Week-5,180201-007911,1-Feb-18,Journal,663677953,International Journal of Mechanical and Production Engineering Research and Development,J,Transstellar Journal Publications and Research Consultancy Private Limited (TJPRC),-,2018,8,1,Article,"EXPERIMENTAL INVESTIGATION AND OPTIMIZTION OF WELDING
PARAMETERS OF METAL INERT GAS WELDING PROCESS
IN JOINING DISSIMILAR METALS",Single Article missing,Missing content,-,-,Spi
Week-5,180201-007911,1-Feb-18,Journal,663677953,International Journal of Mechanical and Production Engineering Research and Development,J,Transstellar Journal Publications and Research Consultancy Private Limited (TJPRC),-,2018,8,1,Article,"MULTI RESPONSE OBJECTIVE OPTIMIZATION OF FRICTION STIR WELDING
PARAMETERS OF DISSIMILAR METALS OF AA 6061 ALUMINUMAND
IS319 BRASS JOINING THROUGH TAGUCHI’S METHOD",Single Article missing,Missing content,-,-,Spi
Week-5,180201-007911,1-Feb-18,Journal,663677953,International Journal of Mechanical and Production Engineering Research and Development,J,Transstellar Journal Publications and Research Consultancy Private Limited (TJPRC),-,2018,8,1,Article,"QUANTIFICATION OF PRIORITIZED REQUIREMENTS OF STEEL
PRODUCT WITH QFD ANALYSIS",Single Article missing,Missing content,-,-,Spi
Week-5,180201-007911,1-Feb-18,Journal,663677953,International Journal of Mechanical and Production Engineering Research and Development,J,Transstellar Journal Publications and Research Consultancy Private Limited (TJPRC),-,2018,8,1,Article,"EVALUATION OF ENGINEERING PROPERTIES OF FLEXIBLE
PAVEMENTS USING PLAXIS SOFTWARE",Single Article missing,Missing content,-,-,Spi
